{
  "$schema": "http://json-schema.org/draft-07/schema#",
  "$id": "gate-results.schema.json",
  "title": "Project Gate Results",
  "description": "Machine-readable output of verify-project-gate.mjs --write or run-project-gate.mjs --write",
  "type": "object",
  "required": ["generatedAt", "tool", "ok", "projectId", "gate", "checks", "summary"],
  "properties": {
    "generatedAt": {
      "type": "string",
      "format": "date-time"
    },
    "tool": {
      "type": "string",
      "enum": ["verify-project-gate.mjs", "run-project-gate.mjs"]
    },
    "ok": {
      "type": "boolean"
    },
    "projectId": {
      "type": "string"
    },
    "gate": {
      "type": "string",
      "description": "Gate label. `G6-partial` = partial acceptance run for a G5 pending-reconcile project; it is not a G6 PASS and never satisfies the G7 prerequisite.",
      "enum": ["G0", "G1", "G2", "G3", "G4", "G5", "G6", "G7", "G8", "G6-partial"]
    },
    "partial": {
      "type": "boolean",
      "description": "True when the run used --partial (contract/browser acceptance items recorded as pending-reconcile)."
    },
    "checks": {
      "type": "array",
      "items": {
        "type": "object",
        "required": ["ruleId", "ok", "message", "file", "severity"],
        "properties": {
          "ruleId": { "type": "string" },
          "ok": { "type": "boolean" },
          "message": { "type": "string" },
          "file": { "type": "string" },
          "severity": {
            "type": "string",
            "enum": ["error", "warn", "waived"]
          },
          "category": {
            "type": "string",
            "enum": ["documentation", "implementation", "build-quality"]
          },
          "evidence": { "type": ["object", "string"] }
        },
        "additionalProperties": false
      }
    },
    "groups": {
      "type": "object",
      "properties": {
        "documentation": {
          "type": "object",
          "required": ["total", "ok", "warn", "waived", "fail"],
          "properties": {
            "total": { "type": "integer", "minimum": 0 },
            "ok": { "type": "integer", "minimum": 0 },
            "warn": { "type": "integer", "minimum": 0 },
            "waived": { "type": "integer", "minimum": 0 },
            "fail": { "type": "integer", "minimum": 0 }
          },
          "additionalProperties": false
        },
        "implementation": {
          "type": "object",
          "required": ["total", "ok", "warn", "waived", "fail"],
          "properties": {
            "total": { "type": "integer", "minimum": 0 },
            "ok": { "type": "integer", "minimum": 0 },
            "warn": { "type": "integer", "minimum": 0 },
            "waived": { "type": "integer", "minimum": 0 },
            "fail": { "type": "integer", "minimum": 0 }
          },
          "additionalProperties": false
        }
      },
      "additionalProperties": false
    },
    "summary": {
      "type": "object",
      "required": ["total", "ok", "warn", "waived", "fail"],
      "properties": {
        "total": { "type": "integer", "minimum": 0 },
        "ok": { "type": "integer", "minimum": 0 },
        "warn": { "type": "integer", "minimum": 0 },
        "waived": { "type": "integer", "minimum": 0 },
        "fail": { "type": "integer", "minimum": 0 }
      },
      "additionalProperties": false
    },
    "commands": {
      "type": "array",
      "items": {
        "type": "object",
        "required": ["label", "status", "ok", "startedAt"],
        "properties": {
          "label": { "type": "string" },
          "status": { "type": "integer" },
          "ok": { "type": "boolean" },
          "startedAt": { "type": "string", "format": "date-time" },
          "finishedAt": { "type": "string", "format": "date-time" }
          ,"logFile": { "type": ["string", "null"] }
        },
        "additionalProperties": false
      }
    },
    "fingerprint": {
      "type": "object",
      "required": ["headSha", "baseSha", "dirtyHash", "dirtyFileCount", "rulesetVersion"],
      "properties": {
        "headSha": { "type": "string" },
        "baseSha": { "type": "string" },
        "dirtyHash": { "type": "string" },
        "dirtyFileCount": { "type": "integer", "minimum": 0 },
        "untrackedFileCount": { "type": "integer", "minimum": 0 },
        "rulesetVersion": { "type": "string" },
        "ruleReleaseFingerprint": { "type": "string" },
        "effectiveRulesFingerprint": { "type": "string" }
      },
      "additionalProperties": false
    },
    "codeRules": {
      "type": "object",
      "required": ["required", "skipped", "reason", "ok"],
      "properties": {
        "required": { "type": "boolean" },
        "skipped": { "type": "boolean" },
        "reason": { "type": "string" },
        "ok": { "type": "boolean" }
      },
      "additionalProperties": false
    },
    "buildQuality": {
      "type": "object",
      "required": ["required", "skipped", "reason", "ok"],
      "properties": {
        "required": { "type": "boolean" },
        "skipped": { "type": "boolean" },
        "reason": { "type": "string" },
        "ok": { "type": "boolean" },
        "checkCount": { "type": "integer", "minimum": 0 },
        "baselineFile": { "type": ["string", "null"] }
      },
      "additionalProperties": false
    },
    "source": {
      "type": "object",
      "properties": {
        "gateCommand": { "type": "string" },
        "parseError": {},
        "codeRulesCommand": { "type": ["string", "null"] },
        "codeRulesParseError": {}
      },
      "additionalProperties": true
    },
    "stageSync": {
      "type": "object",
      "required": ["attempted", "ok"],
      "properties": {
        "attempted": { "type": "boolean" },
        "ok": { "type": "boolean" }
      },
      "additionalProperties": false
    },
    "cache": {
      "type": "object",
      "required": ["hit", "fingerprint"],
      "properties": {
        "hit": { "type": "boolean" },
        "fingerprint": { "type": "string" }
      },
      "additionalProperties": false
    },
    "deliverySummary": {
      "type": "object",
      "required": ["attempted", "ok"],
      "properties": {
        "attempted": { "type": "boolean" },
        "ok": { "type": "boolean" },
        "file": { "type": ["string", "null"] }
      },
      "additionalProperties": false
    }
  },
  "allOf": [
    {
      "$comment": "gate=G6-partial 必须 partial=true：两字段不一致（如 gate=G6-partial 却 partial=false，或反过来）说明写入端逻辑串了，直接 schema 拒。",
      "if": { "properties": { "gate": { "const": "G6-partial" } }, "required": ["gate"] },
      "then": { "properties": { "partial": { "const": true } }, "required": ["partial"] }
    },
    {
      "if": { "properties": { "partial": { "const": true } }, "required": ["partial"] },
      "then": { "properties": { "gate": { "const": "G6-partial" } }, "required": ["gate"] }
    }
  ],
  "additionalProperties": false
}
