{
  "generatedAt": "2026-08-23T10:37:18.775Z",
  "tool": "run-project-gate.mjs",
  "projectId": "PR-02306",
  "gate": "G8",
  "ok": true,
  "summary": {
    "total": 100,
    "ok": 95,
    "warn": 4,
    "waived": 1,
    "fail": 0
  },
  "groups": {
    "documentation": {
      "total": 87,
      "ok": 83,
      "warn": 3,
      "waived": 1,
      "fail": 0
    },
    "implementation": {
      "total": 6,
      "ok": 6,
      "warn": 0,
      "waived": 0,
      "fail": 0
    }
  },
  "checks": [
    {
      "ruleId": "DOC-STRUCT-001",
      "ok": true,
      "message": "project directory exists: apps/web/docs_tdd/PR-02306",
      "file": "../docs_tdd/prds/PR-02306",
      "severity": "error",
      "category": "documentation"
    },
    {
      "ruleId": "DOC-STRUCT-002",
      "ok": true,
      "message": "required file exists: README.md",
      "file": "../docs_tdd/prds/PR-02306/README.md",
      "severity": "error",
      "category": "documentation"
    },
    {
      "ruleId": "DOC-STRUCT-003",
      "ok": true,
      "message": "required file exists: product/00-feature-inventory.md",
      "file": "../docs_tdd/prds/PR-02306/product/00-feature-inventory.md",
      "severity": "error",
      "category": "documentation"
    },
    {
      "ruleId": "DOC-STRUCT-004",
      "ok": true,
      "message": "required file exists: product/01-scope-and-phases.md",
      "file": "../docs_tdd/prds/PR-02306/product/01-scope-and-phases.md",
      "severity": "error",
      "category": "documentation"
    },
    {
      "ruleId": "DOC-STRUCT-005",
      "ok": true,
      "message": "required file exists: product/02-technical-design.md",
      "file": "../docs_tdd/prds/PR-02306/product/02-technical-design.md",
      "severity": "error",
      "category": "documentation"
    },
    {
      "ruleId": "DOC-STRUCT-006",
      "ok": true,
      "message": "required file exists: product/03-api-contract.md",
      "file": "../docs_tdd/prds/PR-02306/product/03-api-contract.md",
      "severity": "error",
      "category": "documentation"
    },
    {
      "ruleId": "DOC-STRUCT-007",
      "ok": true,
      "message": "required file exists: product/04-frontend-tasks.md",
      "file": "../docs_tdd/prds/PR-02306/product/04-frontend-tasks.md",
      "severity": "error",
      "category": "documentation"
    },
    {
      "ruleId": "DOC-STRUCT-008",
      "ok": true,
      "message": "required file exists: product/05-ui-and-interaction.md",
      "file": "../docs_tdd/prds/PR-02306/product/05-ui-and-interaction.md",
      "severity": "error",
      "category": "documentation"
    },
    {
      "ruleId": "DOC-STRUCT-009",
      "ok": true,
      "message": "required file exists: product/06-collaboration.md",
      "file": "../docs_tdd/prds/PR-02306/product/06-collaboration.md",
      "severity": "error",
      "category": "documentation"
    },
    {
      "ruleId": "DOC-STRUCT-010",
      "ok": true,
      "message": "required file exists: product/07-figma-spec.md",
      "file": "../docs_tdd/prds/PR-02306/product/07-figma-spec.md",
      "severity": "error",
      "category": "documentation"
    },
    {
      "ruleId": "DOC-STRUCT-011",
      "ok": true,
      "message": "required file exists: engineering/development-rules.md",
      "file": "../docs_tdd/prds/PR-02306/engineering/development-rules.md",
      "severity": "error",
      "category": "documentation"
    },
    {
      "ruleId": "DOC-STRUCT-012",
      "ok": true,
      "message": "required file exists: agent/README.md",
      "file": "../docs_tdd/prds/PR-02306/agent/README.md",
      "severity": "error",
      "category": "documentation"
    },
    {
      "ruleId": "DOC-G0-001",
      "ok": true,
      "message": "feature inventory records PRD source",
      "file": "../docs_tdd/prds/PR-02306/product/00-feature-inventory.md",
      "severity": "error",
      "category": "documentation"
    },
    {
      "ruleId": "DOC-G0-002",
      "ok": true,
      "message": "feature inventory has feature list section",
      "file": "../docs_tdd/prds/PR-02306/product/00-feature-inventory.md",
      "severity": "error",
      "category": "documentation"
    },
    {
      "ruleId": "DOC-G0-003",
      "ok": true,
      "message": "feature inventory has acceptance mapping section",
      "file": "../docs_tdd/prds/PR-02306/product/00-feature-inventory.md",
      "severity": "error",
      "category": "documentation"
    },
    {
      "ruleId": "DOC-G0-004",
      "ok": true,
      "message": "feature inventory has unreadable PRD content section",
      "file": "../docs_tdd/prds/PR-02306/product/00-feature-inventory.md",
      "severity": "warn",
      "category": "documentation"
    },
    {
      "ruleId": "DOC-PRD-001",
      "ok": true,
      "message": "PRD source manifest exists and has the expected project/collections",
      "file": "../docs_tdd/prds/PR-02306/agent/prd-source-manifest.json",
      "severity": "error",
      "category": "documentation"
    },
    {
      "ruleId": "DOC-PRD-002",
      "ok": true,
      "message": "PRD source exists: apps/web/docs_tdd/prds/PR-02306/inbox/lark-sync/prd-latest.extracted.md",
      "file": "../docs_tdd/prds/PR-02306/agent/prd-source-manifest.json",
      "severity": "error",
      "category": "documentation"
    },
    {
      "ruleId": "DOC-PRD-008",
      "ok": true,
      "message": "PRD source hash has not drifted: apps/web/docs_tdd/prds/PR-02306/inbox/lark-sync/prd-latest.extracted.md",
      "file": "../docs_tdd/prds/PR-02306/agent/prd-source-manifest.json",
      "severity": "error",
      "category": "documentation"
    },
    {
      "ruleId": "DOC-PRD-003",
      "ok": true,
      "message": "all PRD images/tables/embeds are inventoried",
      "file": "../docs_tdd/prds/PR-02306/agent/prd-source-manifest.json",
      "severity": "error",
      "category": "documentation"
    },
    {
      "ruleId": "DOC-PRD-008",
      "ok": true,
      "message": "local PRD image assets have not drifted",
      "file": "../docs_tdd/prds/PR-02306/agent/prd-source-manifest.json",
      "severity": "error",
      "category": "documentation"
    },
    {
      "ruleId": "DOC-PRD-004",
      "ok": true,
      "message": "PRD source IDs are unique",
      "file": "../docs_tdd/prds/PR-02306/agent/prd-source-manifest.json",
      "severity": "error",
      "category": "documentation"
    },
    {
      "ruleId": "DOC-PRD-005",
      "ok": true,
      "message": "all PRD rich-media inputs are locally readable, read, classified, summarized, and evidenced",
      "file": "../docs_tdd/prds/PR-02306/agent/prd-source-manifest.json",
      "severity": "error",
      "category": "documentation"
    },
    {
      "ruleId": "DOC-PRD-006",
      "ok": true,
      "message": "requirement inputs map to Feature IDs and decorative inputs record disposition",
      "file": "../docs_tdd/prds/PR-02306/agent/prd-source-manifest.json",
      "severity": "error",
      "category": "documentation"
    },
    {
      "ruleId": "DOC-PRD-007",
      "ok": true,
      "message": "requirement inputs and Feature IDs are traceable in frontend tasks",
      "file": "../docs_tdd/prds/PR-02306/agent/prd-source-manifest.json",
      "severity": "error",
      "category": "documentation"
    },
    {
      "ruleId": "DOC-PRD-009",
      "ok": true,
      "message": "G2-approved PRD fingerprint matches current intake (expected=9eefd5dbb3b07dfb, current=9eefd5dbb3b07dfb)",
      "file": "../docs_tdd/prds/PR-02306/agent/prd-source-manifest.json",
      "severity": "error",
      "category": "documentation"
    },
    {
      "ruleId": "DOC-PRD-010",
      "ok": true,
      "message": "remote PRD content hash matches intake baseline (cached 2s ago): 需求 PRD (revision 354)",
      "file": "../docs_tdd/prds/PR-02306/agent/prd-source-manifest.json",
      "severity": "error",
      "category": "documentation"
    },
    {
      "ruleId": "DOC-G1-001",
      "ok": true,
      "message": "G1 scope document records the current scope",
      "file": "../docs_tdd/prds/PR-02306/product/01-scope-and-phases.md",
      "severity": "error",
      "category": "documentation"
    },
    {
      "ruleId": "DOC-G1-002",
      "ok": true,
      "message": "G1 technical design contains reuse inventory scaffold",
      "file": "../docs_tdd/prds/PR-02306/product/02-technical-design.md",
      "severity": "error",
      "category": "documentation"
    },
    {
      "ruleId": "DOC-G1-003",
      "ok": true,
      "message": "G1 frontend tasks contain a task inventory",
      "file": "../docs_tdd/prds/PR-02306/product/04-frontend-tasks.md",
      "severity": "error",
      "category": "documentation"
    },
    {
      "ruleId": "DOC-G1-004",
      "ok": true,
      "message": "G1 collaboration document records decisions or pending items",
      "file": "../docs_tdd/prds/PR-02306/product/06-collaboration.md",
      "severity": "error",
      "category": "documentation"
    },
    {
      "ruleId": "DOC-G2-001",
      "ok": true,
      "message": "feature inventory has no blocking placeholders",
      "file": "../docs_tdd/prds/PR-02306/product/00-feature-inventory.md",
      "severity": "error",
      "category": "documentation"
    },
    {
      "ruleId": "DOC-G2-002",
      "ok": true,
      "message": "G2 confirmer and date are filled",
      "file": "../docs_tdd/prds/PR-02306/product/00-feature-inventory.md",
      "severity": "error",
      "category": "documentation"
    },
    {
      "ruleId": "DOC-G2-003",
      "ok": true,
      "message": "feature list has at least one feature row",
      "file": "../docs_tdd/prds/PR-02306/product/00-feature-inventory.md",
      "severity": "error",
      "category": "documentation"
    },
    {
      "ruleId": "DOC-G2-004",
      "ok": true,
      "message": "each feature row has 本期=做/不做/延期",
      "file": "../docs_tdd/prds/PR-02306/product/00-feature-inventory.md",
      "severity": "error",
      "category": "documentation"
    },
    {